{
  "schemaVersion": 2,
  "consumer": "Example Workspace",
  "platforms": ["macOS"],
  "packages": [
    {"id": "swift-components", "version": "1.1.1", "source": "release"}
  ],
  "adoptedCapabilities": ["typed-tokens"],
  "sourceRoots": ["Sources"],
  "exceptions": "design-system-exceptions.json"
}
